{
  "format": "portable-ed-corpus",
  "version": 2,
  "license": "0BSD",
  "standard": "POSIX.1-2024",
  "placeholder": "@TMP@",
  "cases": [
    {
      "name": "issue8/address/repeated-leading-comma",
      "requirement": "address.separators",
      "mode": "pipe",
      "arguments": [
        "-s"
      ],
      "stdin": {
        "encoding": "utf8",
        "data": "a\none\ntwo\nthree\nfour\n.\n,,p\nQ\n"
      },
      "expect": [
        {
          "status": 0,
          "stdout": {
            "encoding": "utf8",
            "data": "four\n"
          }
        }
      ]
    },
    {
      "name": "issue8/address/repeated-leading-semicolon",
      "requirement": "address.separators",
      "mode": "pipe",
      "arguments": [
        "-s"
      ],
      "stdin": {
        "encoding": "utf8",
        "data": "a\none\ntwo\nthree\nfour\n.\n;;p\nQ\n"
      },
      "expect": [
        {
          "status": 0,
          "stdout": {
            "encoding": "utf8",
            "data": "four\n"
          }
        }
      ]
    },
    {
      "name": "issue8/address/mixed-leading-comma-semicolon",
      "requirement": "address.separators",
      "mode": "pipe",
      "arguments": [
        "-s"
      ],
      "stdin": {
        "encoding": "utf8",
        "data": "a\none\ntwo\nthree\nfour\n.\n,;p\nQ\n"
      },
      "expect": [
        {
          "status": 0,
          "stdout": {
            "encoding": "utf8",
            "data": "four\n"
          }
        }
      ]
    },
    {
      "name": "issue8/address/mixed-leading-semicolon-comma",
      "requirement": "address.separators",
      "mode": "pipe",
      "arguments": [
        "-s"
      ],
      "stdin": {
        "encoding": "utf8",
        "data": "a\none\ntwo\nthree\nfour\n.\n;,p\nQ\n"
      },
      "expect": [
        {
          "status": 0,
          "stdout": {
            "encoding": "utf8",
            "data": "four\n"
          }
        }
      ]
    },
    {
      "name": "issue8/address/omitted-middle-comma",
      "requirement": "address.separators",
      "mode": "pipe",
      "arguments": [
        "-s"
      ],
      "stdin": {
        "encoding": "utf8",
        "data": "a\none\ntwo\nthree\nfour\n.\n1,,3p\nQ\n"
      },
      "expect": [
        {
          "status": 0,
          "stdout": {
            "encoding": "utf8",
            "data": "one\ntwo\nthree\n"
          }
        }
      ]
    },
    {
      "name": "issue8/address/omitted-middle-semicolon",
      "requirement": "address.separators",
      "mode": "pipe",
      "arguments": [
        "-s"
      ],
      "stdin": {
        "encoding": "utf8",
        "data": "a\none\ntwo\nthree\nfour\n.\n1;;3p\nQ\n"
      },
      "expect": [
        {
          "status": 0,
          "stdout": {
            "encoding": "utf8",
            "data": "one\ntwo\nthree\n"
          }
        }
      ]
    },
    {
      "name": "issue8/address/discard-leading-address",
      "requirement": "address.separators",
      "mode": "pipe",
      "arguments": [
        "-s"
      ],
      "stdin": {
        "encoding": "utf8",
        "data": "a\none\ntwo\nthree\nfour\n.\n1,2,4p\nQ\n"
      },
      "expect": [
        {
          "status": 0,
          "stdout": {
            "encoding": "utf8",
            "data": "two\nthree\nfour\n"
          }
        }
      ]
    },
    {
      "name": "issue8/address/evaluate-before-discard",
      "requirement": "address.separators",
      "mode": "pipe",
      "arguments": [
        "-s"
      ],
      "stdin": {
        "encoding": "utf8",
        "data": "a\none\ntwo\nthree\nfour\n.\n1;/three/;+1p\nQ\n"
      },
      "expect": [
        {
          "status": 0,
          "stdout": {
            "encoding": "utf8",
            "data": "three\nfour\n"
          }
        }
      ]
    },
    {
      "name": "issue8/address/blank-separated-positive-offsets",
      "requirement": "address.separators",
      "mode": "pipe",
      "arguments": [
        "-s"
      ],
      "stdin": {
        "encoding": "utf8",
        "data": "a\none\ntwo\nthree\nfour\n.\n1 +1 +1p\nQ\n"
      },
      "expect": [
        {
          "status": 0,
          "stdout": {
            "encoding": "utf8",
            "data": "three\n"
          }
        }
      ]
    },
    {
      "name": "issue8/address/blank-separated-negative-offsets",
      "requirement": "address.separators",
      "mode": "pipe",
      "arguments": [
        "-s"
      ],
      "stdin": {
        "encoding": "utf8",
        "data": "a\none\ntwo\nthree\nfour\n.\n4 -1 -1p\nQ\n"
      },
      "expect": [
        {
          "status": 0,
          "stdout": {
            "encoding": "utf8",
            "data": "two\n"
          }
        }
      ]
    },
    {
      "name": "issue8/change-state/warning-survives-print",
      "requirement": "buffer.change-state",
      "mode": "pipe",
      "arguments": [
        "-s"
      ],
      "stdin": {
        "encoding": "utf8",
        "data": "a\nabc\n.\nq\np\nq\n"
      },
      "expect": [
        {
          "status": 0,
          "stdout": {
            "encoding": "utf8",
            "data": "?\nabc\n"
          }
        }
      ]
    },
    {
      "name": "issue8/change-state/new-change-rearms-warning",
      "requirement": "buffer.change-state",
      "mode": "pipe",
      "arguments": [
        "-s"
      ],
      "stdin": {
        "encoding": "utf8",
        "data": "a\nabc\n.\nq\ns/a/a/\nq\nq\n"
      },
      "expect": [
        {
          "status": 0,
          "stdout": {
            "encoding": "utf8",
            "data": "?\n?\n"
          }
        }
      ]
    },
    {
      "name": "issue8/change-state/undo-is-a-change",
      "requirement": "command.undo",
      "mode": "pipe",
      "arguments": [
        "-s"
      ],
      "stdin": {
        "encoding": "utf8",
        "data": "a\nabc\n.\nu\nq\nq\n"
      },
      "expect": [
        {
          "status": 0,
          "stdout": {
            "encoding": "utf8",
            "data": "?\n"
          }
        }
      ]
    },
    {
      "name": "issue8/change-state/global-no-change-undo-noop",
      "requirement": "command.undo",
      "mode": "pipe",
      "arguments": [
        "-s"
      ],
      "stdin": {
        "encoding": "utf8",
        "data": "a\none\ntwo\n.\ng/missing/d\nu\n1,$p\nQ\n"
      },
      "expect": [
        {
          "status": 0,
          "stdout": {
            "encoding": "utf8",
            "data": "one\ntwo\n"
          }
        }
      ]
    },
    {
      "name": "issue8/change-state/empty-append-is-unchanged",
      "requirement": "command.append",
      "mode": "pipe",
      "arguments": [
        "-s"
      ],
      "stdin": {
        "encoding": "utf8",
        "data": "a\n.\nq\n"
      },
      "expect": [
        {
          "status": 0,
          "stdout": {
            "encoding": "utf8",
            "data": ""
          }
        }
      ]
    },
    {
      "name": "issue8/change-state/empty-insert-is-unchanged",
      "requirement": "command.insert",
      "mode": "pipe",
      "arguments": [
        "-s"
      ],
      "stdin": {
        "encoding": "utf8",
        "data": "0i\n.\nq\n"
      },
      "expect": [
        {
          "status": 0,
          "stdout": {
            "encoding": "utf8",
            "data": ""
          }
        }
      ]
    },
    {
      "name": "issue8/change-state/full-write-clears-change",
      "requirement": "command.write",
      "mode": "pipe",
      "arguments": [
        "-s"
      ],
      "stdin": {
        "encoding": "utf8",
        "data": "a\nabc\n.\nw @TMP@/saved\nq\n"
      },
      "expect": [
        {
          "status": 0,
          "stdout": {
            "encoding": "utf8",
            "data": ""
          },
          "files": [
            {
              "path": "saved",
              "data": {
                "encoding": "utf8",
                "data": "abc\n"
              }
            }
          ]
        }
      ]
    },
    {
      "name": "issue8/change-state/warned-edit-takes-effect",
      "requirement": "command.edit",
      "mode": "pipe",
      "arguments": [
        "-s"
      ],
      "stdin": {
        "encoding": "utf8",
        "data": "a\nold\n.\nq\ne @TMP@/replacement\np\nq\n"
      },
      "fixtures": [
        {
          "path": "replacement",
          "data": {
            "encoding": "utf8",
            "data": "new\n"
          }
        }
      ],
      "expect": [
        {
          "status": 0,
          "stdout": {
            "encoding": "utf8",
            "data": "?\nnew\n"
          }
        }
      ]
    },
    {
      "name": "issue8/change-state/no-op-substitution-is-a-change",
      "requirement": "command.substitute",
      "mode": "pipe",
      "arguments": [
        "-s",
        "@TMP@/input"
      ],
      "stdin": {
        "encoding": "utf8",
        "data": "s/a/a/\nq\nq\n"
      },
      "fixtures": [
        {
          "path": "input",
          "data": {
            "encoding": "utf8",
            "data": "a\n"
          }
        }
      ],
      "expect": [
        {
          "status": 0,
          "stdout": {
            "encoding": "utf8",
            "data": "?\n"
          }
        }
      ]
    },
    {
      "name": "issue8/delimiter/omitted-substitute",
      "requirement": "command.substitute",
      "mode": "pipe",
      "arguments": [
        "-s"
      ],
      "stdin": {
        "encoding": "utf8",
        "data": "a\nalpha\nbeta\nabc\n.\ns/abc/ABC\nQ\n"
      },
      "expect": [
        {
          "status": 0,
          "stdout": {
            "encoding": "utf8",
            "data": "ABC\n"
          }
        }
      ]
    },
    {
      "name": "issue8/delimiter/omitted-global",
      "requirement": "command.global",
      "mode": "pipe",
      "arguments": [
        "-s"
      ],
      "stdin": {
        "encoding": "utf8",
        "data": "a\nalpha\nbeta\nabc\n.\ng/a\nQ\n"
      },
      "expect": [